{
  "schema_version": "1.0.0",
  "product_version": "0.0.4-controlled-prototype",
  "evidence_revision": "7202fc819b70982c013e1ca11a4fcc136e01e2de",
  "publication_scope": "internal-prototype",
  "pages": [
    {
      "documentation_id": "PDOC-0001",
      "path": "apps/docs/content/docs/index.mdx",
      "route": "/docs",
      "title": "Platform Documentation Prototype",
      "content_class": "landing",
      "audience": ["administrator", "developer", "evaluator", "operator", "support", "user"],
      "owner": "Developer Platform",
      "publication_state": "internal-prototype",
      "applicable_version": "0.0.4-controlled-prototype",
      "evidence_revision": "7202fc819b70982c013e1ca11a4fcc136e01e2de",
      "last_verified": "2026-07-16",
      "implementation_evidence": [
        "apps/docs/package.json",
        "docs/project/PROGRAM_STATUS.md"
      ],
      "related_capabilities": [],
      "permission_refs": [],
      "contract_refs": [
        "docs/blueprint/07-Developer-Platform/PRODUCT_DOCUMENTATION_AND_KNOWLEDGE_ARCHITECTURE.md"
      ]
    },
    {
      "documentation_id": "PDOC-0002",
      "path": "apps/docs/content/docs/getting-started/index.mdx",
      "route": "/docs/getting-started",
      "title": "Getting Started",
      "content_class": "getting-started",
      "audience": ["developer", "evaluator", "operator"],
      "owner": "Developer Platform",
      "publication_state": "internal-prototype",
      "applicable_version": "0.0.4-controlled-prototype",
      "evidence_revision": "7202fc819b70982c013e1ca11a4fcc136e01e2de",
      "last_verified": "2026-07-16",
      "implementation_evidence": [
        "docker-compose.yml",
        "apps/server/src/router.test.ts",
        "apps/web/src/lib/shell.test.ts"
      ],
      "related_capabilities": [
        "platform.authentication",
        "platform.organizations"
      ],
      "permission_refs": [],
      "contract_refs": [
        "docs/blueprint/17-Roadmap/FIRST_SLICE_IMPLEMENTATION_PLAN.md"
      ]
    },
    {
      "documentation_id": "PDOC-0003",
      "path": "apps/docs/content/docs/user-guides/index.mdx",
      "route": "/docs/user-guides",
      "title": "Prototype User Guide",
      "content_class": "user-guide",
      "audience": ["administrator", "evaluator", "user"],
      "owner": "Platform Experience",
      "publication_state": "internal-prototype",
      "applicable_version": "0.0.4-controlled-prototype",
      "evidence_revision": "7202fc819b70982c013e1ca11a4fcc136e01e2de",
      "last_verified": "2026-07-16",
      "implementation_evidence": [
        "apps/web/src/components/administration-pages.tsx",
        "apps/web/src/lib/shell.test.ts",
        "docs/implementation/WS1_VERIFICATION_AND_CONTROLLED_PROTOTYPE_CLOSEOUT.md"
      ],
      "related_capabilities": [
        "platform.authentication",
        "platform.organizations",
        "platform.party",
        "platform.authorization",
        "platform.entitlements",
        "platform.audit"
      ],
      "permission_refs": [
        "platform.organization.read",
        "party.record.read",
        "platform.role.read",
        "platform.entitlement.read",
        "platform.audit.read"
      ],
      "contract_refs": [
        "openapi/first-slice-v1.yaml",
        "registry/endpoint-permissions.json"
      ]
    },
    {
      "documentation_id": "PDOC-0004",
      "path": "apps/docs/content/docs/administration/index.mdx",
      "route": "/docs/administration",
      "title": "Prototype Administration",
      "content_class": "administrator-guide",
      "audience": ["administrator", "developer", "operator", "support"],
      "owner": "Platform Administration",
      "publication_state": "internal-prototype",
      "applicable_version": "0.0.4-controlled-prototype",
      "evidence_revision": "7202fc819b70982c013e1ca11a4fcc136e01e2de",
      "last_verified": "2026-07-16",
      "implementation_evidence": [
        "apps/web/src/components/administration-pages.tsx",
        "apps/server/src/router.test.ts",
        "docs/implementation/WS1_VERIFICATION_AND_CONTROLLED_PROTOTYPE_CLOSEOUT.md"
      ],
      "related_capabilities": [
        "platform.authentication",
        "platform.organizations",
        "platform.party",
        "platform.authorization",
        "platform.entitlements",
        "platform.audit"
      ],
      "permission_refs": [
        "platform.organization.read",
        "party.record.read",
        "platform.role.read",
        "platform.entitlement.read",
        "platform.audit.read"
      ],
      "contract_refs": [
        "openapi/first-slice-v1.yaml",
        "registry/endpoint-permissions.json"
      ]
    },
    {
      "documentation_id": "PDOC-0005",
      "path": "apps/docs/content/docs/api/index.mdx",
      "route": "/docs/api",
      "title": "Prototype API Reference",
      "content_class": "api-reference",
      "audience": ["developer", "integrator"],
      "owner": "Developer Platform",
      "publication_state": "internal-prototype",
      "applicable_version": "0.0.4-controlled-prototype",
      "evidence_revision": "7202fc819b70982c013e1ca11a4fcc136e01e2de",
      "last_verified": "2026-07-16",
      "implementation_evidence": [
        "apps/server/src/router.ts",
        "apps/server/src/router.test.ts",
        "packages/contracts/platform-api/src/generated.ts"
      ],
      "related_capabilities": [
        "platform.authentication",
        "platform.organizations",
        "platform.party",
        "platform.authorization",
        "platform.entitlements",
        "platform.audit",
        "platform.events",
        "catalog.products",
        "inventory.adjustments",
        "inventory.counts",
        "inventory.stock-balances",
        "inventory.transfers"
      ],
      "permission_refs": [
        "platform.organization.read",
        "platform.organization.update",
        "platform.user.read",
        "platform.user.invite",
        "platform.user.suspend",
        "party.record.read",
        "party.record.create",
        "party.record.update",
        "platform.role.read",
        "platform.role.assign",
        "platform.entitlement.read",
        "platform.audit.read",
        "platform.event.replay",
        "catalog.product.read",
        "catalog.product.create",
        "catalog.product.update",
        "catalog.product.activate",
        "catalog.product.archive",
        "inventory.adjustment.read",
        "inventory.adjustment.create",
        "inventory.adjustment.approve",
        "inventory.adjustment.reverse",
        "inventory.balance.read",
        "inventory.count.read",
        "inventory.count.create",
        "inventory.count.submit",
        "inventory.count.approve",
        "inventory.transfer.read",
        "inventory.transfer.create",
        "inventory.transfer.dispatch",
        "inventory.transfer.receive"
      ],
      "contract_refs": [
        "openapi/first-slice-v1.yaml",
        "registry/endpoint-permissions.json"
      ],
      "api_reference_mode": "generated-canonical",
      "generated_reference_source": "openapi/first-slice-v1.yaml"
    },
    {
      "documentation_id": "PDOC-0006",
      "path": "apps/docs/content/docs/developer/index.mdx",
      "route": "/docs/developer",
      "title": "Developer Guide",
      "content_class": "developer-guide",
      "audience": ["developer", "integrator"],
      "owner": "Engineering",
      "publication_state": "internal-prototype",
      "applicable_version": "0.0.4-controlled-prototype",
      "evidence_revision": "7202fc819b70982c013e1ca11a4fcc136e01e2de",
      "last_verified": "2026-07-16",
      "implementation_evidence": [
        "AGENTS.md",
        "registry/architecture-rules.json",
        "scripts/check_architecture.py"
      ],
      "related_capabilities": [],
      "permission_refs": [],
      "contract_refs": [
        "docs/blueprint/14-Engineering/ARCHITECTURE_DEPENDENCY_RULES.md",
        "docs/blueprint/14-Engineering/ENGINEERING_HANDBOOK.md"
      ]
    },
    {
      "documentation_id": "PDOC-0007",
      "path": "apps/docs/content/docs/migrations/index.mdx",
      "route": "/docs/migrations",
      "title": "Database Migrations",
      "content_class": "migration-guide",
      "audience": ["developer", "operator"],
      "owner": "Engineering",
      "publication_state": "internal-prototype",
      "applicable_version": "0.0.4-controlled-prototype",
      "evidence_revision": "7202fc819b70982c013e1ca11a4fcc136e01e2de",
      "last_verified": "2026-07-16",
      "implementation_evidence": [
        "apps/server/composition/migrate.ts",
        "apps/server/composition/migrations.ts",
        "packages/persistence/platform-identity-postgres/src/schema.test.ts"
      ],
      "related_capabilities": ["platform.data-migration"],
      "permission_refs": [],
      "contract_refs": [
        "docs/blueprint/01-Platform/IMPORT_EXPORT_AND_DATA_MIGRATION.md",
        "docs/blueprint/02-Architecture/DATA_OWNERSHIP_AND_CONSISTENCY.md"
      ]
    },
    {
      "documentation_id": "PDOC-0010",
      "path": "apps/docs/content/docs/operations/index.mdx",
      "route": "/docs/operations",
      "title": "Event Backbone Operations",
      "content_class": "operator-guide",
      "audience": ["developer", "operator", "support"],
      "owner": "Platform Operations",
      "publication_state": "internal-prototype",
      "applicable_version": "0.0.4-controlled-prototype",
      "evidence_revision": "7202fc819b70982c013e1ca11a4fcc136e01e2de",
      "last_verified": "2026-07-16",
      "implementation_evidence": [
        "apps/worker/composition/delivery.ts",
        "apps/server/composition/events.ts",
        "docs/blueprint/19-Appendices/WS2_PR4_EVENT_DELIVERY_EVIDENCE-2026-07-15.md"
      ],
      "related_capabilities": [
        "platform.events",
        "catalog.products",
        "inventory.stock-ledger"
      ],
      "permission_refs": ["platform.event.replay"],
      "contract_refs": [